Links,Claims,Date,Date
https://www.indiatoday.in//fact-check/story/viral-video-of-officer-singing-ghar-se-nikalte-hi-is-not-of-captain-deepak-sathe-1709478-2020-08-09, Video collage shows incompetent Indian paratroopers and the stunning performance of Pakistani paratroopers,3-Aug-20,3-Aug-20
https://www.indiatoday.in//fact-check/story/fact-check-image-of-monks-in-kumbh-mela-falsely-circulated-as-that-of-ayodya-bhoomi-pujan-1709413-2020-08-09, Video shows France bidding farewell to Rafales destined for India with its jets forming the Tricolour in the skies,2-Aug-20,2-Aug-20
https://www.indiatoday.in//fact-check/story/fact-check-viral-video-showing-cattle-being-washed-away-in-floodwaters-is-not-from-kerala-s-wayanad-1709248-2020-08-08," Video shows a Rafale jet refuelling mid-air at 30,000 feet while heading for India from France",2-Aug-20,2-Aug-20
https://www.indiatoday.in//fact-check/story/fact-check-sunni-waqf-board-build-babri-hospital-5-acre-land-allotted-ayodhya-1709003-2020-08-08," Despite Covid-19 regulations, massive crowds throng Bengaluru’s KR Market for Varamahalakshmi Vratam festivities",1-Aug-20,1-Aug-20
https://www.indiatoday.in//fact-check/story/this-girl-standing-next-to-sooraj-pancholi-is-not-sushant-singh-rajput-ex-manager-disha-salian-1708999-2020-08-07,"  Air Commodore Hilal Ahmad Rather is the first pilot to fly Rafale jets from France to India Air Commodore Hilal Ahmad Rather, who played a key role in the delivery of Rafale jets to India never flew it from France to India",31-Jul-20,31-Jul-20
https://www.indiatoday.in//fact-check/story/no-salman-rushdie-never-said-muslims-destroy-a-nation-in-the-name-of-islam-1708907-2020-08-07, Video shows Congress workers shouting “Hindustan Murdabad”,30-Jul-20,30-Jul-20
https://www.indiatoday.in//fact-check/story/fact-check-no-these-cars-were-not-damaged-in-recent-beirut-explosion-1708894-2020-08-07, A doctor from Garg hospital of Muzaffarnagar is arrested for stealing a kidney from a COVID-19 patient,30-Jul-20,30-Jul-20
https://www.indiatoday.in//fact-check/story/fact-check-did-communist-government-in-kerala-impose-a-blackout-on-august-5-1708807-2020-08-07, French President Emmanuel Macron has congratulated India on Twitter before the first batch of Rafale fighter jets arrived from France,29-Jul-20,29-Jul-20
https://www.indiatoday.in//fact-check/story/this-is-not-a-picture-of-beirut-after-the-blasts-1708546-2020-08-06," Prime Minister Narendra Modi has released Ramayana stamps, before the “bhoomi pujan” at the Ayodhya Ram temple site on August 5",29-Jul-20,29-Jul-20
https://www.indiatoday.in//fact-check/story/shah-rukh-khan-is-not-donating-rs-5-crore-for-ayodhya-ram-temple-1708192-2020-08-05," For the first time in the history of India, lakhs of Shiva Lingas were seen in Shivakashi river in Karnataka",29-Jul-20,29-Jul-20
https://www.indiatoday.in//fact-check/story/fact-check-stunning-image-of-football-field-encircled-by-forests-is-not-from-india-1708054-2020-08-05, Video shows BJP MLA from Patna being thrashed by locals over poor condition of roads,29-Jul-20,29-Jul-20
https://www.indiatoday.in//fact-check/story/fact-check-bihar-congress-uses-amphan-image-to-take-a-dig-at-nitish-kumar-over-floods-1707852-2020-08-05, Video shows Pakistan flags being waved at Rajasthan chief minister Ashok Gehlot’s rally,28-Jul-20,28-Jul-20
https://www.indiatoday.in//fact-check/story/fact-check-men-in-lingerie-passed-off-as-isis-fighters-with-bizarre-story-1707816-2020-08-04," Image shows weaver who hung himself from his loom, driven by extreme poverty, in Prime Minister Narendra Modi’s constituency Varanasi",28-Jul-20,28-Jul-20
https://www.indiatoday.in//fact-check/story/fact-check-this-tragic-story-behind-the-creation-of-subway-surfers-is-not-true-1707775-2020-08-04, AIIMS has released a list of respiratory symptoms of Covid-19 and similar diseases,28-Jul-20,28-Jul-20
https://www.indiatoday.in//fact-check/story/conspiracy-theory-bill-gates-backed-polio-vaccine-disabled-kids-1707666-2020-08-04," Khadi India has replaced Mahatma Gandhi’s picture with that of PM Modi in its advertisement for face masks, three of which are being sold for Rs 999",28-Jul-20,28-Jul-20
https://www.indiatoday.in//fact-check/story/viral-tweet-rajinikanth-apologising-travelling-without-e-pass-fake-1707429-2020-08-03, Hollywood actor Tom Hanks was arrested in Australia for paedophilia,27-Jul-20,27-Jul-20
https://www.indiatoday.in//fact-check/story/fact-check-pak-social-media-users-appropriate-stunning-jumps-by-indian-paratroopers-1707295-2020-08-03, This sketch of a temple with golden domes and water bodies is the design of Ram temple at AyodhyaThis picture is a 3D visualisation of an ISKCON temple at Mayapur in West Bengal,27-Jul-20,27-Jul-20
https://www.indiatoday.in//fact-check/story/fact-check-italy-s-republic-day-ceremony-passed-off-as-france-s-farewell-to-rafale-1707108-2020-08-02, Image shows Dr Zahid Majeed from AIIMS who was infected with coronavirus after mouth-to-mouth resuscitation to a critical Covid-19 patient,27-Jul-20,27-Jul-20
https://www.indiatoday.in//fact-check/story/fact-check-no-this-is-not-a-rafale-jet-refuelling-mid-air-en-route-india-1707065-2020-08-02, This girl singing “Deewana hua badal” is the granddaughter of legendary singer Kishore Kumar and daughter of his son Amit Kumar,27-Jul-20,27-Jul-20
https://www.indiatoday.in//fact-check/story/fact-check-viral-video-of-massive-crowd-at-bengaluru-market-wasn-t-shot-this-year-1706837-2020-08-01," Picture shows late former Prime Minister Rajiv Gandhi with priests during the “bhoomi pujan” of Ram temple at Ayodhya on November 9, 1989",26-Jul-20,26-Jul-20
https://www.indiatoday.in//fact-check/story/fact-check-no-kashmir-s-hilal-ahmad-rather-didn-t-fly-rafale-jet-from-france-to-india-1706391-2020-07-31, Samajwadi Party MP Azam Khan has said he will take ‘jal samadhi’ in Saryu river if not invited to ‘bhoomi pujan’ of Ayodhya Ram temple on August 5,26-Jul-20,26-Jul-20
https://www.indiatoday.in//fact-check/story/fact-check-truth-behind-hindustan-murdabad-slogans-at-a-congress-event-1706174-2020-07-30, Video shows Bhedaghat waterfall in Madhya Pradesh The video is of Jog Falls in Karnataka,26-Jul-20,26-Jul-20
https://www.indiatoday.in//fact-check/story/fact-check-old-news-of-kidney-stealing-from-a-muzaffarnagar-hospital-gone-viral-linking-it-falsely-to-covid-19-1706168-2020-07-30, Video shows two men being thrashed inside a district magistrate’s office in Haryana,25-Jul-20,25-Jul-20
https://www.indiatoday.in//fact-check/video/did-this-doctor-remove-his-ppe-kit-to-save-a-corona-patient-1705819-2020-07-29, Images show Indian fighter jet shot down by Nepal after it crossed over into Nepalese territory to conduct an airstrike,25-Jul-20,25-Jul-20
https://www.indiatoday.in//fact-check/story/fact-check-netizens-fall-for-parody-account-of-macron-congratulating-india-on-rafale-1705740-2020-07-29, Video shows Krishna eagle that flew inside a Krishna temple in Kerala’s Idukki district and sat on a Garuda statue,25-Jul-20,25-Jul-20
https://www.indiatoday.in//fact-check/story/fact-check-these-ramayana-stamps-released-by-pm-modi-are-not-related-to-bhoomi-pujan-1705695-2020-07-29, Picture shows Muslims rewriting Hindu holy books,25-Jul-20,25-Jul-20
https://www.indiatoday.in//fact-check/story/shiva-lingas-karnataka-shivakashi-river-fact-check-1705612-2020-07-29, Picture shows Donald Trump kissing convicted sex offender Jeffrey Epstein in the backseat of a car,24-Jul-20,24-Jul-20
https://www.indiatoday.in//fact-check/story/fact-check-unrelated-clips-merged-to-falsely-claim-that-patna-bjp-mla-was-thrashed-1705606-2020-07-29," NASA has added a 13th zodiac sign named ""Ophiuchus""",23-Jul-20,23-Jul-20
https://www.indiatoday.in//fact-check/story/fact-check-pakistan-flags-were-not-waved-at-ashok-gehlot-s-rally-1705400-2020-07-28," In Mumbai's Gorai, a person's organs were stolen after he was admitted in a hospital on the pretext of Covid-19",23-Jul-20,23-Jul-20
https://www.indiatoday.in//fact-check/story/fact-check-weaver-s-suicide-wrongly-linked-to-pm-modi-and-his-constituency-1705382-2020-07-28," WhatsApp is releasing two videos called ""Martinelli"" and ""Dance of the Pope""",22-Jul-20,22-Jul-20
https://www.indiatoday.in//fact-check/story/fact-check-aiims-coronavirus-symptoms-1705276-2020-07-28, This aerial shot of a huge region submerged in floodwater is from Bihar,21-Jul-20,21-Jul-20
https://www.indiatoday.in//fact-check/story/fact-check-khadi-india-is-not-selling-three-masks-for-rs-999-1705087-2020-07-28, Picture shows little girl who died of Covid-19,21-Jul-20,21-Jul-20
https://www.indiatoday.in//fact-check/story/fact-check-was-tom-hanks-arrested-in-australia-for-pedophilia-1705066-2020-07-27, Viral picture shows how Antarctica looks from space – a huge white patch on one side of the earth,20-Jul-20,20-Jul-20
https://www.indiatoday.in//fact-check/story/fact-check-this-is-not-how-the-ram-temple-ayodhya-will-look-like-1704990-2020-07-27, Video shows Indian missile crashed within seconds of its launch,20-Jul-20,20-Jul-20
https://www.indiatoday.in//fact-check/story/aiims-doctor-fact-check-coronavirus-rumours-1704926-2020-07-27, Collage of six photos shows the present flood situation in Assam,20-Jul-20,20-Jul-20
https://www.indiatoday.in//fact-check/story/fact-check-this-girl-with-a-beautiful-voice-is-not-related-to-kishore-kumar-1704904-2020-07-27, Picture shows a grand palace built by Chola emperor Rajaraja I for his wife in Gujarat’s Patan village,20-Jul-20,20-Jul-20
https://www.indiatoday.in//fact-check/story/fact-check-false-claims-of-rajiv-gandhi-at-ram-temple-bhoomi-pujan-go-viral-1704708-2020-07-26, Video from Bengaluru’s Victoria Hospital shows a huge crowd of patients in a small space outside an OPD,19-Jul-20,19-Jul-20
https://www.indiatoday.in//fact-check/story/fact-check-wrong-azam-khan-goes-viral-over-ram-temple-bhoomi-pujan-remarks-1704680-2020-07-26, Pictures show a young boy from Assam saving a fawn from the floods by risking his own life,19-Jul-20,19-Jul-20
https://www.indiatoday.in//fact-check/story/fact-check-netizens-fight-over-this-stunning-waterfall-here-s-the-truth-1704659-2020-07-26," Tata Motors has come up with a new electric car called EVision, which can run up to 1,000 kms on being charged once and the battery has a 10-year warranty",19-Jul-20,19-Jul-20
https://www.indiatoday.in//fact-check/story/fact-check-truth-behind-video-showing-two-men-being-thrashed-in-an-office-chamber-1704438-2020-07-25, 16 Amarnath pilgrims were killed after their bus fell into a ravine in Kashmir,18-Jul-20,18-Jul-20
https://www.indiatoday.in//fact-check/story/fact-check-iaf-did-not-conduct-airstrike-in-nepal-nor-was-its-jet-shot-down-1704426-2020-07-25," A Covid-19 patient died outside a medical shop in Siwan, which is the constituency of Bihar health minister Mangal Pandey",18-Jul-20,18-Jul-20
https://www.indiatoday.in//fact-check/story/fact-check-story-of-the-eagle-that-refuses-to-leave-a-krishna-temple-1704422-2020-07-25, Video from Delhi’s Madipur area shows three Muslims stabbing to death a minor Hindu boy in the middle of the road over a petty matter,18-Jul-20,18-Jul-20
https://www.indiatoday.in//fact-check/story/fact-check-image-of-muslim-youths-studying-hindu-holy-books-takes-a-communal-turn-1704416-2020-07-25, American tech giants Google and Apple have removed Palestine from their map services,18-Jul-20,18-Jul-20
https://www.indiatoday.in//fact-check/story/fact-check-this-picture-of-trump-kissing-convicted-sex-offender-epstein-is-doctored-1703807-2020-07-24," A cobbler in West Bengal, Sanjoy Rabidas, scored 93% in West Bengal board exams",18-Jul-20,18-Jul-20
https://www.indiatoday.in//fact-check/story/fact-check-nasa-did-not-introduce-a-13th-zodiac-sign-1703736-2020-07-23, The Union government issued a gazette notification cancelling the police station bail system in India,17-Jul-20,17-Jul-20
https://www.indiatoday.in//fact-check/story/fact-check-rumours-of-organ-trade-under-the-garb-of-covid-19-go-viral-1703651-2020-07-23, Picture from Bihar shows a waterlogged hospital ward filled with patients,16-Jul-20,16-Jul-20
https://www.indiatoday.in//fact-check/video/is-this-an-indian-missile-crashing-1703387-2020-07-22," Swapna Suresh, key accused in the Kerala gold smuggling case, is actually a Muslim and her real name is Mumtaz Ismail",16-Jul-20,16-Jul-20
https://www.indiatoday.in//fact-check/story/fact-check-old-hoaxes-about-whatsapp-malware-go-viral-again-1703294-2020-07-22," Young girl singing ""The Girl From Ipanema"" is the daughter of Hollywood actor Julia Roberts",16-Jul-20,16-Jul-20
https://www.indiatoday.in//fact-check/story/fact-check-aerial-shot-of-huge-region-submerged-in-floodwater-is-not-from-bihar-1702995-2020-07-21, WHO has said that bubonic plague detected in China can trigger a severe epidemic,15-Jul-20,15-Jul-20
https://www.indiatoday.in//fact-check/story/fact-check-little-girl-killed-in-sri-lanka-easter-bombings-linked-to-covid-19-1702973-2020-07-21, AIMIM chief Asaduddin Owaisi had said there’s nothing like coronavirus and the government is fooling people,15-Jul-20,15-Jul-20
https://www.indiatoday.in//fact-check/video/is-this-boy-assam-s-bahubali-1702950-2020-07-21, Video shows monkeys being tortured during potential Covid-19 vaccine tests on them,14-Jul-20,14-Jul-20
https://www.indiatoday.in//fact-check/story/fact-check-is-this-antarctica-as-seen-from-space-not-really-1702651-2020-07-20," Picture shows college students in Alabama, United States, throwing 'Covid-19' parties to see who gets infected first",14-Jul-20,14-Jul-20
https://www.indiatoday.in//fact-check/story/russian-rocket-crash-passed-off-as-india-s-failed-missile-test-1702646-2020-07-20, Video of Hindus thrashing a Muslim family,14-Jul-20,14-Jul-20
https://www.indiatoday.in//fact-check/story/fact-check-unrelated-images-passed-off-as-visuals-from-the-horrific-assam-floods-1702620-2020-07-20," Picture shows Swapna Suresh, key accused in the Kerala gold smuggling case, at CM Pinarayi Vijayan's daughter's wedding last month",13-Jul-20,13-Jul-20
https://www.indiatoday.in//fact-check/story/fact-check-gujarat-s-rani-ki-vav-shared-as-palace-built-by-chola-emperor-for-wife-1702600-2020-07-20, A Russian medical university has completed clinical trials of the world's first Covid-19 vaccine,13-Jul-20,13-Jul-20
https://www.indiatoday.in//fact-check/story/fact-check-video-of-packed-crowds-in-a-hospital-is-not-from-bengaluru-1702290-2020-07-19, The Kerala government has brought in a new law under which Muslims or Christians can be the chairman of a temple trust,13-Jul-20,13-Jul-20
https://www.indiatoday.in//fact-check/story/fact-check-misleading-claims-about-this-boy-rescuing-a-baby-deer-flood-social-media-1702281-2020-07-19, Picture shows Apache helicopters deployed underwater by India at Pangong Tso to track and destroy Chinese submarines,13-Jul-20,13-Jul-20
https://www.indiatoday.in//fact-check/story/fact-check-tata-s-concept-sedan-drives-misleading-claims-on-social-media-1702251-2020-07-19," Super scary sound was emitting from a mountain in Guizhou, China, for more than 10 days",12-Jul-20,12-Jul-20
https://www.indiatoday.in//fact-check/story/fact-check-this-bus-accident-involving-amarnath-yatris-is-three-years-old-1702028-2020-07-18," Swapna Suresh, prime accused in Kerala’s sensational gold smuggling case, threatened to expose ministers through a Facebook post",12-Jul-20,12-Jul-20
https://www.indiatoday.in//fact-check/story/fact-check-image-of-deceased-man-falsely-linked-to-covid-19-and-bihar-bjp-minister-1702020-2020-07-18," Defence minister Rajnath Singh, in a letter to PM Modi, has said that CDS Gen",11-Jul-20,11-Jul-20
https://www.indiatoday.in//fact-check/story/fact-check-murder-caught-on-cam-goes-viral-with-communal-spin-1702007-2020-07-18, Video of Muslim mob attacking a Hindu boy with swords in Nalasopara near Mumbai,11-Jul-20,11-Jul-20
https://www.indiatoday.in//fact-check/story/fact-check-google-apple-and-the-palestine-dilemma-1701913-2020-07-18, Picture of Atal Bihari Vajpayee arriving at Parliament on a bullock cart to protest the introduction of computers by Rajiv Gandhi,11-Jul-20,11-Jul-20
https://www.indiatoday.in//fact-check/story/the-topper-who-walked-out-from-a-tale-of-twisted-truth-1701752-2020-07-18, The decades old Mahasivratri celebrations held by Pakistani Hindus in Shree Ratneshwar Mahadev Temple in Karachi have been completely eradicated,10-Jul-20,10-Jul-20
https://www.indiatoday.in//fact-check/story/has-union-govt-revoked-the-power-of-police-to-grant-bail-1701667-2020-07-17," Police busted a sex racket in Kulgam, J&K",10-Jul-20,10-Jul-20
https://www.indiatoday.in//fact-check/story/fact-check-distressing-image-of-waterlogged-hospital-goes-viral-with-misleading-claim-1701316-2020-07-16, This is an old photo of gangster Vikash Dubey prostrating in front of Uttar Pradesh chief minister Yogi Adityanath,10-Jul-20,10-Jul-20
https://www.indiatoday.in//fact-check/story/fact-check-social-media-claims-kerala-gold-smuggling-accused-swapna-suresh-is-a-muslim-1701309-2020-07-16, Pictures show bodies being thrown into the Ganges in Patna to hide the actual number of Covid deaths,10-Jul-20,10-Jul-20
https://www.indiatoday.in//fact-check/story/fact-check-hold-your-beer-she-not-julia-roberts-daughter-doppelganger-1701131-2020-07-16," Ivanka Trump gave example of the Bihar girl who cycled 1,200 km carrying her injured father during lockdown to hit out at those criticising Donald Trump over the Covid-19 spread in US",10-Jul-20,10-Jul-20
https://www.indiatoday.in//fact-check/story/fact-check-it-s-too-early-to-predict-a-bubonic-plague-epidemic-1701016-2020-07-15, Video shows Africans performing puja on the first Monday of 'Sawan' month,9-Jul-20,9-Jul-20
https://www.indiatoday.in//fact-check/story/fact-check-owaisi-never-denied-the-existence-of-coronavirus-1700951-2020-07-15, American model of South Sudanese descent Nyakim Gatwech enters Guinness World Records for the darkest skin ever seen on earth,9-Jul-20,9-Jul-20
https://www.indiatoday.in//fact-check/video/did-iaf-deploy-apache-helicopters-underwater-at-pangong-tso-to-thwart-chinese-adventurism-1700921-2020-07-15," AMU alumna Khushboo Mirza has been promoted as director of ISRO, only the second Muslim after late Dr APJ Abdul Kalam to hold the post",9-Jul-20,9-Jul-20
https://www.indiatoday.in//fact-check/story/this-disturbing-viral-video-of-animal-cruelly-is-not-of-covid19-vaccine-test-1700605-2020-07-14, This long stretch of road filled with huge potholes is from Rahul Gandhi’s Parliamentary constituency of Wayanad in Kerala,9-Jul-20,9-Jul-20
https://www.indiatoday.in//fact-check/story/covid-parties-may-be-happening-but-this-is-something-else-1700601-2020-07-14, Video of Covid-19 patient escaping police and health workers in Telangana,8-Jul-20,8-Jul-20
https://www.indiatoday.in//fact-check/story/deo-of-man-being-thrashed-goes-viral-with-communal-spin-1700492-2020-07-14, Woman police officer seen in the viral picture is posted in the same area where her father pulls a rickshaw,8-Jul-20,8-Jul-20
https://www.indiatoday.in//fact-check/story/fact-check-image-of-gold-smuggling-accused-at-wedding-of-kerala-cm-s-daughter-is-morphed-1700235-2020-07-13, Man seen putting foot on Hindu idol is a Muslim named Mohammad Ansari,8-Jul-20,8-Jul-20
https://www.indiatoday.in//fact-check/story/do-not-pin-your-hopes-on-that-successful-russian-vaccine-1700228-2020-07-13, Video shows eagle carrying a shark in its claws and flying over the seas,8-Jul-20,8-Jul-20
https://www.indiatoday.in//fact-check/story/fact-check-kerala-didn-t-bring-in-new-law-saying-temples-can-be-controlled-by-non-hindus-1700188-2020-07-13, The Israeli Air Force has bombarded nuclear facilities in Iran,8-Jul-20,8-Jul-20
https://www.indiatoday.in//fact-check/story/fact-check-chopper-at-jordan-underwater-museum-shared-as-iaf-apache-below-pangong-tso-1700155-2020-07-13," The picture is of Kaleem, a rickshaw-puller in Lucknow, who was jailed and fined Rs 21 lakh by the UP government for bringing anti-CAA protesters to rallies",7-Jul-20,7-Jul-20
https://www.indiatoday.in//fact-check/story/fact-check-mystery-behind-strange-sounds-coming-from-a-mountain-in-china-1699808-2020-07-12, Video of a man using air quality monitoring machine proves that people using masks to protect themselves from Covid-19 aren't getting enough oxygen,7-Jul-20,7-Jul-20
https://www.indiatoday.in//fact-check/story/fact-check-did-kerala-gold-smuggling-case-accused-threaten-to-expose-ministers-1699707-2020-07-12, Video shows moving train loaded with military equipment en route Indo-China border,6-Jul-20,6-Jul-20
https://www.indiatoday.in//fact-check/story/fact-check-did-bipin-rawat-seek-army-chief-s-dismissal-over-ladakh-crisis-1699563-2020-07-11," Caricature created by American cartoonist Ben Garrison, depicting the state of Indian media",5-Jul-20,5-Jul-20
https://www.indiatoday.in//fact-check/video/are-covid-19-dead-bodies-being-thrown-into-the-ganga-1699527-2020-07-11," Picture shows Dr VK Srinivas, vice-president of Bharat Biotech, taking the first dose of coronavirus vaccine “Covaxin” developed by his team, as part of human trial",4-Jul-20,4-Jul-20
https://www.indiatoday.in//fact-check/story/fact-check-video-of-sword-wielding-men-slashing-youth-goes-viral-with-communal-spin-1699510-2020-07-11," Actress Kangana Ranaut has released Sridevi's autopsy report that says she was forcefully fed cocaine, had injuries and her death was unnatural",3-Jul-20,3-Jul-20
https://www.indiatoday.in//fact-check/story/fact-check-why-atal-bihari-vajpayee-arrived-parliament-bullock-cart-1699474-2020-07-11, French astrologer Nostradamus had predicted the outbreak of coronavirus in his book “Les Prophéties”,3-Jul-20,3-Jul-20
https://www.indiatoday.in//fact-check/story/fact-check-did-pakistan-govt-ban-mahashivratri-celebrations-1699289-2020-07-10, Budweiser admits several employees have been pissing in its beer tanks for years,2-Jul-20,2-Jul-20
https://www.indiatoday.in//fact-check/story/fact-check-these-are-not-kashmiri-girls-involved-in-a-sex-racket-in-kulgam-1699256-2020-07-10, Video shows people protesting in Nepal against their Prime Minister KP Sharma Oli for kowtowing China,1-Jul-20,1-Jul-20
https://www.indiatoday.in//fact-check/story/fact-check-man-kneeling-in-front-of-yogi-adityanath-is-not-vikas-dubey-1699236-2020-07-10, Telugu has been voted as the second best script in the world by International Alphabet Association,1-Jul-20,1-Jul-20
https://www.indiatoday.in//fact-check/story/face-check-pictures-show-bodies-of-coronavirus-patients-being-thrown-in-ganges-river-ganga-patna-viral-1698903-2020-07-10, Man wrapped in a Pakistani flag and holding a gun while standing on the Tricolour is from Kolkata,30-Jun-20,30-Jun-20
https://www.indiatoday.in//fact-check/story/fact-check-did-ivanka-cite-bihar-girl-who-cycled-1-200-kms-to-hit-out-at-critics-1698878-2020-07-10, Video of Indian Air Force's Apache helicopters patrolling over Pangong Tso in Ladakh,30-Jun-20,30-Jun-20
https://www.indiatoday.in//fact-check/story/fact-check-truth-behind-video-of-africans-performing-sawan-somvar-puja-1698851-2020-07-09, Video of Chinese engineer beating Pakistani driver for submitting fake petrol bill in Karachi,29-Jun-20,29-Jun-20
https://www.indiatoday.in//fact-check/story/fact-check-did-this-model-make-it-to-guinness-for-her-dark-skin-tone-1698816-2020-07-09," World Health Organization has warned of a new Nipah virus outbreak in India, which is deadlier than coronavirus",28-Jun-20,28-Jun-20
https://www.indiatoday.in//fact-check/video/has-the-yogi-govt-fined-this-rickshaw-puller-rs-21-lakh-1698761-2020-07-09, Video of Chinese troops humiliating Indian soldiers in Ladakh,28-Jun-20,28-Jun-20
https://www.indiatoday.in//fact-check/story/fact-check-truth-behind-promotion-muslim-woman-scientist-isro-1698684-2020-07-09, Picture of Prime Minister Narendra Modi meeting his “Chinese bosses”,28-Jun-20,28-Jun-20
https://www.indiatoday.in//fact-check/story/fact-check-image-of-potholed-road-in-bihar-used-to-take-a-dig-at-rahul-gandhi-1698618-2020-07-09, Palestinian girl bravely stands up to Israeli security forces to protect the al-Aqsa mosque in Jerusalem,27-Jun-20,27-Jun-20
https://www.indiatoday.in//fact-check/story/fact-check-real-story-behind-man-chased-by-health-workers-in-ppes-1698488-2020-07-08, Restrictions on Baba Ramdev's anti-Covid drug Coronil were imposed by Muslims holding key positions in AYUSH ministry,27-Jun-20,27-Jun-20
https://www.indiatoday.in//fact-check/story/fact-check-fictitious-story-about-woman-police-officer-goes-viral-1698483-2020-07-08," Patients waiting on beds outside a hospital in Old City, HyderabadThe viral video is from a hospital in Pakistan, where patients were evacuated from the building after a fire broke out in the emergency ward",26-Jun-20,26-Jun-20
https://www.indiatoday.in//fact-check/story/fact-check-who-s-this-man-putting-his-foot-on-a-hindu-idol-1698462-2020-07-08, Bhutan has stopped irrigation water to Indian farmers in Assam,26-Jun-20,26-Jun-20
https://www.indiatoday.in//fact-check/story/fact-check-is-that-an-eagle-clutching-a-shark-in-its-claws-1698262-2020-07-08, Video of people ransacking a petrol pump to protest hike in petrol and diesel prices,25-Jun-20,25-Jun-20
https://www.indiatoday.in//fact-check/story/fact-check-did-israel-bomb-iranian-nuclear-facilities-1698253-2020-07-08, This is the farewell video of British Airways employees after the UK airline dismissed its entire workforce on June 15,25-Jun-20,25-Jun-20
https://www.indiatoday.in//fact-check/story/fact-check-this-rickshaw-puller-was-a-lockdown-saviour-wasn-t-jailed-for-anti-caa-protests-1698129-2020-07-07," Dr Saloni Suchak, daughter of Dr Nanavati, has prescribed a list of measures to keep oneself safe from coronavirus",24-Jun-20,24-Jun-20
