Links,Claims,Date,Date
https://www.indiatoday.in//fact-check/story/fact-check-this-is-not-shia-leader-wasim-rizvi-being-thrashed-for-seeking-removal-of-quranic-verses-1785137-2021-03-30," Video shows former UP Shia Central Waqf Board chairman Wasim Rizvi, who recently filed a PIL in the Supreme Court seeking removal of 26 verses from Quran, getting thrashed in Punjab",30-Mar-21,30-Mar-21
https://www.indiatoday.in//fact-check/story/fact-check-picture-of-congress-leaders-with-sheikh-hasina-goes-viral-with-false-claim-1784571-2021-03-28, This picture was taken during the UPA regime when “Sonia Gandhi took PM Manmohan Singh on a tour to Bangladesh”,28-Mar-21,28-Mar-21
https://www.indiatoday.in//fact-check/story/fact-check-this-is-not-tamil-nadu-welcoming-rahul-gandhi-ahead-of-assembly-polls-1784335-2021-03-27, Images show large crowd gathered for Rahul Gandhi's election rally in Tamil Nadu,27-Mar-21,27-Mar-21
https://www.indiatoday.in//fact-check/story/fact-check-this-is-not-the-picture-of-bhagat-singhs-funeral-know-the-story-of-his-cremation-1783175-2021-03-24," Picture of the funeral ceremony of freedom fighters Bhagat Singh, Sukhdev, and Rajguru",24-Mar-21,24-Mar-21
https://www.indiatoday.in//fact-check/story/fact-check-tragic-video-of-students-falling-off-after-railing-collapse-is-from-bolivia-not-assam-1783086-2021-03-24, Seven students died after falling off the fourth floor in Guwahati after the railing gave away,24-Mar-21,24-Mar-21
https://www.indiatoday.in//fact-check/story/fact-check-was-this-old-man-thrashed-for-performing-aarti-at-his-house-in-west-bengal-1782642-2021-03-23, Video shows how an old Hindu man was beaten up for performing ‘aarti’ at his house in West Bengal,23-Mar-21,23-Mar-21
https://www.indiatoday.in//fact-check/story/fact-check-did-gajendra-chauhan-tweet-in-support-of-man-who-thrashed-muslim-boy-in-ghaziabad-1780513-2021-03-17," Actor and former FTII chairman Gajendra Chauhan has come out in support of Shringi Yadav, the man accused of assaulting a minor Muslim boy for allegedly drinking water at a Ghaziabad temple",17-Mar-21,17-Mar-21
https://www.indiatoday.in//fact-check/story/fact-check-this-newspaper-clipping-on-hike-in-mp-allowance-is-three-years-old-1780077-2021-03-16, The Union Cabinet has approved an increase in MP allowances,16-Mar-21,16-Mar-21
https://www.indiatoday.in//fact-check/story/fact-check-viral-claim-saying-all-bjp-mlas-in-punjab-joined-congress-is-false-1780058-2021-03-16, Punjab has become India’s first BJP-free state after all three of its MLAs joined Congress,16-Mar-21,16-Mar-21
https://www.indiatoday.in//fact-check/story/fact-check-morphed-tweet-criticising-bjp-falsely-attributed-to-yashwant-sinha-1779735-2021-03-16, Former Union minister Yashwant Sinha tweeted a rhyme saying India has deteriorated since BJP came to power,16-Mar-21,16-Mar-21
https://www.indiatoday.in//fact-check/story/fact-check-fake-twitter-accounts-of-mithun-chakraborty-crop-up-after-actor-joins-bjp-1779723-2021-03-16, Actor-politician Mithun Chakroborty has tweeted that doctors have advised West Bengal chief minister Mamata Banerjee to rest for five years,16-Mar-21,16-Mar-21
https://www.indiatoday.in//fact-check/story/fact-check-netizens-claim-dhoni-converted-to-buddhism-after-photo-in-monk-attire-goes-viral-1779278-2021-03-14, Former Indian cricket captain Mahendra Singh Dhoni has been initiated into Buddhism,14-Mar-21,14-Mar-21
https://www.indiatoday.in//fact-check/story/photos-delhi-riots-linked-communal-tension-telangana-bhainsa-1779022-2021-03-13, Images show how a Muslim mob attacked Hindus in Telangana's Bhainsa and then looted and burnt their properties,13-Mar-21,13-Mar-21
https://www.indiatoday.in//fact-check/story/image-queen-elizabeth-ii-thanking-pm-modi-for-covid-vaccines-morphed-1778975-2021-03-13, Queen Elizabeth II thanked PM Narendra Modi for Covid-19 vaccines,13-Mar-21,13-Mar-21
https://www.indiatoday.in//fact-check/story/fact-check-did-badruddin-ajmal-say-hindus-will-be-wiped-out-if-aiudf-comes-to-power-in-assam-1777811-2021-03-10," AIUDF chief Badruddin Ajmal has said if they come to power in Assam as part of UPA, they will turn India into an Islamic state and no Hindu will be left here",10-Mar-21,10-Mar-21
https://www.indiatoday.in//fact-check/story/fact-check-morphed-picture-of-us-billboard-used-to-take-a-dig-at-kejriwals-freebies-1777457-2021-03-10," Text on a billboard says, “Nothing in this country is free",10-Mar-21,10-Mar-21
https://www.indiatoday.in//fact-check/video/fact-check-video-this-is-not-an-ex-bsp-mp-pleading-before-up-police-1777376-2021-03-09," After spending 20 years in prison for a crime they never committed, 122 Muslim men were acquitted by a court in Gujarat",7-Mar-21,7-Mar-21
https://www.indiatoday.in//fact-check/story/fact-check-justice-delayed-but-these-men-didn-t-spend-20-years-in-prison-1776676-2021-03-07," The man crying at the feet of police is a former BSP MP and wanted gangster in Uttar Pradesh, who surrendered fearing an encounter",7-Mar-21,7-Mar-21
https://www.indiatoday.in//fact-check/story/fact-check-bsp-mp-not-pleading-before-up-police-1776545-2021-03-07, The image shows a woman holding “No Vote To BJP” placard in the run-up to assembly elections in West Bengal,7-Mar-21,7-Mar-21
https://www.indiatoday.in//fact-check/story/journalists-protest-against-trinamool-passed-off-as-anti-bjp-rally-in-kolkata-1776447-2021-03-07," Trinamool, BJP and CPI(M) supporters are using a picture of Sourav Ganguly with respective party symbols, claiming that he is endorsing them",6-Mar-21,6-Mar-21
https://www.indiatoday.in//fact-check/story/left-trinamool-bjp-supporters-share-sourav-ganguly-morphed-picture-endorsing-them-1776431-2021-03-06," As per “Assam Bachao”, a Facebook campaign page of Assam Congress, these are pictures of tea plantations in Assam",4-Mar-21,4-Mar-21
https://www.indiatoday.in//fact-check/story/fact-check-these-tea-garden-images-shared-by-congress-are-not-from-assam-1775764-2021-03-04, Image shows Congress workers in Puducherry thrashing a Congress MLA who recently joined the BJP,4-Mar-21,4-Mar-21
https://www.indiatoday.in//fact-check/story/fact-check-no-puducherry-congress-mlas-were-not-attacked-for-joining-the-bjp-1775743-2021-03-04," Some beggars in Mangalore, Karnataka found a sobbing little girl and are still waiting for her family members to reunite with her",4-Mar-21,4-Mar-21
https://www.indiatoday.in//fact-check/story/fact-check-don-t-fall-for-this-missing-girl-video-she-has-been-reunited-with-her-family-1775723-2021-03-04, Image shows BJP youth wing leader Pamela Goswami riding a bicycle along with PM Narendra Modi,4-Mar-21,4-Mar-21
https://www.indiatoday.in//fact-check/story/fact-check-this-viral-image-of-pm-modi-riding-bicycle-along-with-pamela-goswami-is-morphed-1775605-2021-03-04, Comedian Shyam Rangeela has tweeted that the maximum number of Nobel Laureates comes from Bengal whereas the highest number of bank robbers hails from Gujarat,3-Mar-21,3-Mar-21
https://www.indiatoday.in//fact-check/story/fact-check-not-so-funny-imposter-mimics-shyam-rangeelas-twitter-account-to-criticise-modi-govt-1775238-2021-03-03," According to BBC, the Left Front-Congress gathering at Kolkata’s Brigade Parade Ground on February 28 was the “world’s largest peaceful political gathering”",2-Mar-21,2-Mar-21
https://www.indiatoday.in//fact-check/story/fact-check-bbc-has-not-called-left-rally-in-kolkata-the-world-s-largest-political-gathering-1774746-2021-03-02, This image of a sea of people is from Sunday’s joint rally of Left Front and Congress in Kolkata’s Brigade Parade Ground,28-Feb-21,28-Feb-21
https://www.indiatoday.in//fact-check/story/fact-check-two-year-old-left-front-rally-in-kolkata-shared-as-feb-28-gathering-1774042-2021-02-28," To make the internet safer, all social media accounts of users need to be verified with a government ID within three months",27-Feb-21,27-Feb-21
https://www.indiatoday.in//fact-check/story/not-mandatory-for-users-to-verify-their-social-media-accounts-within-3-months-1773816-2021-02-27, A vintage bicycle with unique spring wheels and a rifle attached to it was used in police stations in India in the British era,27-Feb-21,27-Feb-21
https://www.indiatoday.in//fact-check/story/know-real-story-vintage-spring-wheel-bicycle-british-world-war-1773714-2021-02-27," Video shows angry cricket fans after the Indian national flag was banned inside the newly inaugurated Narendra Modi Stadium at Motera in Ahmedabad, Gujarat",26-Feb-21,26-Feb-21
https://www.indiatoday.in//fact-check/story/no-the-indian-national-flag-is-not-banned-inside-gujarat-narendra-modi-stadium-1773592-2021-02-26, A viral image of a petrol bill of Sai Balaji Petroleum in Mumbai’s Vikhroli area states that if you want to reduce the petrol price don’t vote for PM Modi again,26-Feb-21,26-Feb-21
https://www.indiatoday.in//fact-check/story/fact-check-viral-image-of-petrol-bill-asking-not-to-vote-for-pm-modi-is-fake-1773371-2021-02-26, Recent visual from Batmaloo area in Srinagar where clashes erupted during a cordon and search operations by security forces,25-Feb-21,25-Feb-21
https://www.indiatoday.in//fact-check/story/fact-check-five-year-old-picture-of-unrest-passed-off-as-recent-clashes-in-srinagar-1773155-2021-02-25, Video shows people trapped after the under-construction Balanagar- Jeedimetla flyover in Hyderabad collapsed,24-Feb-21,24-Feb-21
https://www.indiatoday.in//fact-check/story/fact-check-2018-video-of-varanasi-flyover-collapse-shared-with-misleading-claims-1772670-2021-02-24, Video shows man spitting on rotis while cooking at Red Rose Palace function hall in Hyderabad’s Nampally area,24-Feb-21,24-Feb-21
https://www.indiatoday.in//fact-check/story/fact-check-viral-video-of-meerut-man-spitting-on-rotis-shared-as-incident-from-hyderabad-1772329-2021-02-24, The video shows how BJP is disturbing peace in Bengal,22-Feb-21,22-Feb-21
https://www.indiatoday.in//fact-check/story/fact-check-this-video-of-bjp-workers-attacking-a-house-is-not-from-bengal-1771892-2021-02-22, Picture from Yogi Adityanath’s rally in Kasaragod district of Kerala on February 21,21-Feb-21,21-Feb-21
https://www.indiatoday.in//fact-check/story/fact-check-picture-of-bjp-workers-forming-human-flag-is-not-from-yogi-rally-in-kerala-1771598-2021-02-21, Video shows RSS workers in chains being marched through the streets of Kerala by Popular Front of India (PFI) activists,20-Feb-21,20-Feb-21
https://www.indiatoday.in//fact-check/video/fact-check-video-no-this-green-flag-in-a-congress-rally-is-not-a-pakistani-flag-1771374-2021-02-20, Video shows the Indian Army demolishing Chinese bunkers near Pangong Tso Lake in Ladakh,19-Feb-21,19-Feb-21
https://www.indiatoday.in//fact-check/story/fact-check-these-are-not-rss-workers-dragged-through-the-streets-of-kerala-by-popular-front-1771333-2021-02-20, Image shows the Pakistani national flag being waved during a Congress rally,19-Feb-21,19-Feb-21
https://www.indiatoday.in//fact-check/story/rescue-indian-army-destroying-chinese-bunkers-1771127-2021-02-19, Video shows police arresting a group of terrorists from the Pydhonie area of South Mumbai,18-Feb-21,18-Feb-21
https://www.indiatoday.in//fact-check/story/fact-check-no-this-green-flag-in-a-congress-rally-is-not-a-pakistani-flag-1770748-2021-02-19, This is a rare photograph of former Tamil Nadu chief minister J Jayalalithaa and Union finance minister Nirmala Sitharaman,18-Feb-21,18-Feb-21
https://www.indiatoday.in//fact-check/story/fact-check-web-series-shoot-passed-off-as-terrorists-nabbed-in-mumbai-1770693-2021-02-18," Image shows Swedish climate activist Greta Thunberg, who had tweeted in support of farmers’ protest in India, eating luxuriously in front of poor and starving children",17-Feb-21,17-Feb-21
https://www.indiatoday.in//fact-check/story/fact-check-this-is-not-nirmala-sitharaman-with-jayalalithaa-in-vintage-pic-1770310-2021-02-18, The upcoming assembly elections in West Bengal would be held from April 11 to May 19,17-Feb-21,17-Feb-21
https://www.indiatoday.in//fact-check/story/fact-check-picture-of-greta-thunberg-having-food-in-front-of-poor-kids-is-morphed-1770262-2021-02-17, Picture of Bajrang Dal members in Uttar Pradesh protesting against farm laws and Prime Minister Narendra Modi,17-Feb-21,17-Feb-21
https://www.indiatoday.in//fact-check/story/fact-check-fake-west-bengal-election-schedule-circulates-on-social-media-1770180-2021-02-17, A labourer found gold and silver coins while digging a canal near Wular lake in Jammu and Kashmir,16-Feb-21,16-Feb-21
https://www.indiatoday.in//fact-check/story/fact-check-these-are-not-bajrang-dal-members-in-up-demanding-repeal-of-farm-laws-1770140-2021-02-17," In Germany, people abandoned their cars in the middle of the road to protest fuel price hike",15-Feb-21,15-Feb-21
https://www.indiatoday.in//fact-check/story/fact-check-this-story-treasure-trove-kashmir-italian-connection-1769800-2021-02-16, Pictures of tractor convoys show the recent farmers’ protest in German capital Berlin,15-Feb-21,15-Feb-21
https://www.indiatoday.in//fact-check/story/fact-check-image-of-traffic-jam-in-china-shared-as-german-protest-against-fuel-price-hike-1769538-2021-02-15," It was on February 14, 1931, that Bhagat Singh, Sukhdev and Rajguru were sentenced to death in Lahore",14-Feb-21,14-Feb-21
https://www.indiatoday.in//fact-check/story/fact-check-these-pictures-of-farmers-protest-in-berlin-are-over-a-year-old-1769412-2021-02-15," Images show debris of collapsed buildings in Afghanistan after the country was rocked by an earthquake on February 12, 2021",14-Feb-21,14-Feb-21
https://www.indiatoday.in//fact-check/story/fact-check-bhagat-singh-sukhdev-and-rajguru-were-not-sentenced-to-death-on-february-14-1769186-2021-02-14, These are pictures from Tajikistan where critical damage took place after an earthquake hit the country on the night of February 12,13-Feb-21,13-Feb-21
https://www.indiatoday.in//fact-check/story/fact-check-old-images-from-turkey-shared-damage-caused-earthquake-afghanistan-1769107-2021-02-14," Image shows Amulya, the young woman from Karnataka who raised ""Pakistan zindabad"" slogans at Asaduddin Owaisi’s anti-CAA rally in 2020 in Bengaluru, participating in the ongoing farmers’ protest",12-Feb-21,12-Feb-21
https://www.indiatoday.in//fact-check/story/earthquake-destruction-scenes-not-from-tajikistan-1768970-2021-02-13, Picture of a residential project constructed by the West Bengal government under ‘Amar Bari’ (My House) scheme for slum dwellers in Kolkata,11-Feb-21,11-Feb-21
https://www.indiatoday.in//fact-check/video/fact-check-vdeo-picture-of-housing-project-in-bangladesh-shared-as-mamata-s-scheme-for-slum-dwellers-1768759-2021-02-12, The Delhi high court has ordered Delhi Police to release all farmers held during the ongoing agitation,10-Feb-21,10-Feb-21
https://www.indiatoday.in//fact-check/story/fact-check-this-is-not-amulya-the-girl-who-raised-pakistan-zindabad-slogans-in-2020-at-the-farmers-protest-1768604-2021-02-12," In an apparent dig at the government, Naseeruddin Shah tweeted, ""They want Rs 30 as tax on oil worth Rs 60, but if farmers demand MSP for their hard work, they are traitors",10-Feb-21,10-Feb-21
https://www.indiatoday.in//fact-check/story/fact-check-picture-of-housing-project-in-bangladesh-shared-as-mamata-s-scheme-for-slum-dwellers-1768375-2021-02-11, American professional wrestler Undertaker has supported the farmers’ protest,9-Feb-21,9-Feb-21
https://www.indiatoday.in//fact-check/story/fact-check-delhi-hc-has-not-ordered-release-of-protesters-held-during-farmers-agitation-1768005-2021-02-10, This is the clearest picture of the sun’s surface published by NASA,8-Feb-21,8-Feb-21
https://www.indiatoday.in//fact-check/story/fact-check-man-playing-double-naseeruddin-shah-rakesh-tikait-twitter-1767644-2021-02-10, Sharad Pawar was slapped in public for criticising Sachin Tendulkar,8-Feb-21,8-Feb-21
https://www.indiatoday.in//fact-check/story/fact-check-undertaker-would-rise-from-the-dead-after-this-morphed-tweet-in-support-of-farmers-1767598-2021-02-09, This is the video of the glacier breaking off in Uttarakhand’s Chamoli,8-Feb-21,8-Feb-21
https://www.indiatoday.in//fact-check/video/fact-check-video-was-sharad-pawar-slapped-in-public-for-his-statement-on-tendulkar-1767560-2021-02-09," Soon after getting leave, this soldier rushed to Delhi border to meet his father, who has been protesting against the farm laws for 75 days",7-Feb-21,7-Feb-21
https://www.indiatoday.in//fact-check/video/is-video-liquor-distribution-farmers-protest-1767389-2021-02-09, Video shows free alcohol distribution among farmers protesting against the three farm laws,7-Feb-21,7-Feb-21
https://www.indiatoday.in//fact-check/story/fact-check-nasa-has-nothing-to-do-with-this-edited-image-of-the-sun-surface-1767228-2021-02-08, Indian singer Caralisa Monteiro tweeted a communally charged post that declares India will be “Hindu Mukt” soon,6-Feb-21,6-Feb-21
https://www.indiatoday.in//fact-check/story/fact-check-was-sharad-pawar-slapped-in-public-for-his-statement-on-tendulkar-1767175-2021-02-08, Image shows a group of Congress party workers offering cake to former adult film actress Mia Khalifa's poster,6-Feb-21,6-Feb-21
https://www.indiatoday.in//fact-check/story/fact-check-avalanche-video-from-nepal-shared-as-uttarakhand-glacier-burst-1767146-2021-02-08, Image of a document shows how Congress did not appoint a single district chairman from the Hindu community in Uttar Pradesh,6-Feb-21,6-Feb-21
https://www.indiatoday.in//fact-check/story/fact-check-this-emotional-post-about-a-farmer-and-his-soldier-son-is-misleading-1766878-2021-02-07, Video shows a group of Nihang Sikhs attacking a public bus and resorting to violence during the ongoing farmers’ protest,5-Feb-21,5-Feb-21
https://www.indiatoday.in//fact-check/story/fact-check-this-video-of-liquor-distribution-is-not-from-farmers-protest-1766842-2021-02-07, Pictures of a professor who lost his wife during childbirth,4-Feb-21,4-Feb-21
https://www.indiatoday.in//fact-check/story/viral-tweet-on-hindu-mukt-india-by-bollywood-singer-is-fake-1766680-2021-02-06," Protesting farmers are now making tractors with steel wheels, without tyres and tubes, after the government planted iron spikes and nails on the roads to stop entry of tractors",3-Feb-21,3-Feb-21
https://www.indiatoday.in//fact-check/story/morphed-photo-congress-workers-offering-cake-mia-khalifa-poster-1766686-2021-02-06," In an article written by Joseph Hope, the editor-in-chief of ‘The New York Times’, he has called Narendra Modi “a dangerous patriot” whose leadership skills and political acumen are posing a serious threat to other superpowers",3-Feb-21,3-Feb-21
https://www.indiatoday.in//fact-check/story/fact-check-list-of-up-congress-minority-cell-members-viral-with-a-communal-twist-1766657-2021-02-06," Video shows the crowd at Mumbai’s Borivali station on February 1, the day suburban trains resumed for the general public after a 10-month gap",2-Feb-21,2-Feb-21
https://www.indiatoday.in//fact-check/story/video-of-nihang-sikhs-attacking-public-bus-is-not-related-to-farmers-protest-1766429-2021-02-05," This video was captured from inside a new electric train in Japan that runs at 4,800 kms per hour",2-Feb-21,2-Feb-21
https://www.indiatoday.in//fact-check/story/fact-check-this-is-not-a-widowed-professor-carrying-his-baby-to-class-1765933-2021-02-04, Picture shows men in civil dress deployed by Delhi Police at farmers’ protest,2-Feb-21,2-Feb-21
https://www.indiatoday.in//fact-check/story/fact-check-these-antique-steel-wheeled-tractors-have-no-connection-with-farmers-protests-1765672-2021-02-03, This picture of a man holding a placard against the Ram temple at Ayodhya was taken during the ongoing farmers’ agitation,31-Jan-21,31-Jan-21
https://www.indiatoday.in//fact-check/story/fact-check-this-article-praising-pm-modi-was-not-published-by-the-new-york-times-1765308-2021-02-03," SRM Institute of Science and Technology, Chennai, and St",31-Jan-21,31-Jan-21
https://www.indiatoday.in//fact-check/story/fact-check-this-was-not-the-rush-at-borivali-station-after-local-trains-resumed-in-mumbai-1765304-2021-02-02, As many as 200 Delhi Police personnel have submitted collective resignation in solidarity with the protesting farmers,31-Jan-21,31-Jan-21
https://www.indiatoday.in//fact-check/story/fact-check-viral-video-of-japan-lightning-fast-electric-train-is-not-real-1764990-2021-02-02, A fake farmer who waved a sword at security personnel during the Republic Day violence in Delhi was left with a bandaged head and bruised face,30-Jan-21,30-Jan-21
https://www.indiatoday.in//fact-check/story/fact-check-this-image-of-men-in-police-gear-and-civil-clothes-is-not-linked-to-farmers-stir-1764978-2021-02-02," In a moment of rage, a BJP official hit some women with a water tanker and ran over them, when they were on their way to participate in the farmers’ protest march in Delhi",30-Jan-21,30-Jan-21
https://www.indiatoday.in//fact-check/story/fact-check-pro-khalistan-rally-in-san-francisco-passed-off-as-farmers-agitation-in-india-1764565-2021-01-31, The person in the photo disguised himself as a farmer and attacked police to defame the protest against farm laws,29-Jan-21,29-Jan-21
https://www.indiatoday.in//fact-check/story/fact-check-no-boyfriend-no-entry-these-college-circulars-are-too-filmy-to-be-true-1764478-2021-01-31, Video shows police breaking CCTV cameras during the violence that erupted in Delhi on Republic Day,29-Jan-21,29-Jan-21
https://www.indiatoday.in//fact-check/story/fact-check-no-200-policemen-in-delhi-havent-resigned-in-support-of-farmers-1764456-2021-01-31," This picture of Dr Kafeel Khan, an accused in the Gorakhpur infant deaths case, was taken at the tractor rally in Delhi on Republic Day",28-Jan-21,28-Jan-21
https://www.indiatoday.in//fact-check/story/fact-check-unrelated-image-shared-as-police-action-against-protesting-farmers-1764295-2021-01-30, Images show vehicles vandalised during the January 26 violence in Delhi,27-Jan-21,27-Jan-21
https://www.indiatoday.in//fact-check/story/fact-check-video-of-water-tanker-hitting-women-en-route-farmers-protest-has-no-political-connection-1764205-2021-01-30, An Uttar Pradesh Police vehicle is seen here chasing a farmer’s tractor that was going to participate in the Republic Day tractor rally in Delhi,27-Jan-21,27-Jan-21
https://www.indiatoday.in//fact-check/story/fact-check-seven-year-old-image-from-up-wrongly-linked-to-farmers-agitation-1764071-2021-01-29, Rahul Gandhi thinks that the Indian Army can be replaced by labourers and farmers,26-Jan-21,26-Jan-21
https://www.indiatoday.in//fact-check/story/fact-check-this-video-of-police-damaging-cctv-is-not-linked-to-january-26-tractor-rally-1763750-2021-01-29, Khalistani flag hoisted on Red Fort on Republic Day by protesting farmers,26-Jan-21,26-Jan-21
https://www.indiatoday.in//fact-check/story/fact-check-dr-kafeel-khan-was-not-part-of-tractor-rally-in-delhi-on-republic-day-1763724-2021-01-28," Mamata Banerjee can recite Islamic prayers at a government event, but has a problem with “Jai Shree Ram” chants",24-Jan-21,24-Jan-21
https://www.indiatoday.in//fact-check/story/fact-check-pulwama-attack-protest-pictures-shared-as-january-26-tractor-rally-violence-1763381-2021-01-27, Image shows a Friday namaz held at the foot of US Capitol Hill after Joe Biden became the US President,24-Jan-21,24-Jan-21
https://www.indiatoday.in//fact-check/story/fact-check-video-of-cops-pursuing-sand-mafia-passed-off-as-up-police-chasing-farmer-1763360-2021-01-27, WhatsApp will now record the calls of its users,23-Jan-21,23-Jan-21
https://www.indiatoday.in//fact-check/story/fact-check-rahul-gandhi-did-not-suggest-replacing-indian-army-with-labourers-at-china-border-1762983-2021-01-26, US President Joe Biden invited India’s neighbouring countries for his inaugural ceremony,22-Jan-21,22-Jan-21
https://www.indiatoday.in//fact-check/story/fact-check-truth-of-the-flag-hoisted-at-red-fort-by-protesting-farmers-1762991-2021-01-26, Video shows Karnataka government officials faking the Covid-19 vaccination process,21-Jan-21,21-Jan-21
https://www.indiatoday.in//fact-check/video/edited-clip-of-mamata-reciting-islamic-prayers-linked-to-netaji-event-controversy-1762653-2021-01-25," Donald Trump left a letter for Joe Biden, the 46th President of the United States, at his Oval Office in The White House",21-Jan-21,21-Jan-21
https://www.indiatoday.in//fact-check/story/fact-check-edited-clip-of-mamata-reciting-islamic-prayers-linked-to-netaji-event-controversy-1762285-2021-01-24, Images show clear blue flood waters in Thailand’s Pattani province,21-Jan-21,21-Jan-21
https://www.indiatoday.in//fact-check/video/these-officials-posing-for-covid-19-vaccine-is-not-what-it-looks-like-1762122-2021-01-23, Microsoft co-founder Bill Gates has said in an interview to CNBC that 7 lakh people face death or disability due to the Covid-19 vaccines,20-Jan-21,20-Jan-21
https://www.indiatoday.in//fact-check/story/fact-check-decade-old-image-of-friday-namaz-at-us-capitol-hill-viral-with-misleading-claims-1762125-2021-01-24," Madrasas in Uttar Pradesh that do not hoist the national flag or sing the national anthem on Republic Day will be closed, according to the Yogi Adityanath government",20-Jan-21,20-Jan-21
https://www.indiatoday.in//fact-check/story/fact-check-no-whatsapp-is-not-recording-your-calls-but-privacy-concerns-can-t-be-ruled-out-yet-1762105-2021-01-23, The new Covid-19 strain appeared within a week of the United Kingdom getting its first vaccine,19-Jan-21,19-Jan-21
